filename,公司全称,公司简称,公司代码,文件名称,落款日期,会议类型,文件目录,会议召开时间,篇幅页码,字数
145994319_2025-10-12_滨化股份2025年第一次临时股东会会议材料（修订版）.pdf,滨化集团股份有限公司,滨化集团,未找到,2025年第一次临时股东会会议材料（修订版）,2025-10-01,临时股东会,会议议程;会议须知;关于发行H股股票并在香港联合交易所有限公司上市的议案;关于发行H股股票并在香港联合交易所有限公司上市方案的议案;关于公司转为境外募集股份有限公司的议案;关于发行H股股票募集资金使用计划的议案;关于本次发行H股股票并在香港联合交易所有限公司上市决议有效期的议案;关于授权董事会及其授权人士全权处理与本次H股股票发行并上市有关事项的议案;关于发行H股股票并在香港联合交易所有限公司上市前滚存利润分配方案的议案;关于投保董事、高级管理人员及招股说明书责任保险的议案;关于聘请发行H股股票并在香港联合交易所有限公司上市审计机构的议案;关于变更公司注册资本并修订《公司章程》的议案;关于修订《公司章程》及其附件（H股上市后适用）的议案;关于修订公司相关制度的议案;关于选举陈艳女士为独立董事的议案;关于确定公司董事角色的议案,2025年10月16日,26,14214
145994322_2025-10-14_龙岩卓越新能源股份有限公司2025年第一次临时股东大会会议资料.pdf,龙岩卓越新能源股份有限公司,卓越新能,688196,2025年第一次临时股东大会会议资料,2025-10,临时股东会,2025年第一次临时股东大会会议须知;2025年第一次临时股东大会会议议程;2025年第一次临时股东大会会议议案;议案一：关于续聘会计师事务所的议案;议案二：关于修订《公司章程》的议案;议案三：关于修订部分公司治理制度的议案;附件一：《公司章程》修订对照表,2025年10月27日14点0分,48,42060
145994327_2025-10-14_2025年第二次临时股东大会会议资料.pdf,浙江新中港热电股份有限公司,浙江新中港热电,未找到,2025年第二次临时股东大会会议资料,2025-10-27,临时股东会,2025年第二次临时股东大会会议须知;2025年第二次临时股东大会会议议程;议案一：关于取消监事会、变更注册资本、增加经营范围、修订<公司章程>并办理工商变更的议案;议案二：关于修订部分治理制度的议案;议案三：关于续聘会计师事务所的议案,2025年10月27日,10,4602
145994376_2025-10-15_2025年第二次临时股东会会议资料.pdf,江苏康为世纪生物科技股份有限公司,江苏康为世纪生物科技,未找到,2025年第二次临时股东会会议资料,2025-10-29,临时股东会,2025年第二次临时股东会会议须知;2025年第二次临时股东会会议议程;2025年第二次临时股东会会议议案;议案一《关于续聘公司2025年度财务审计机构及内控审计机构的议案》,2025年10月29日,6,3351
145994384_2025-10-15_2025年第一次临时股东大会会议资料.pdf,上海新致软件股份有限公司,新致软件,未找到,2025年第一次临时股东大会会议资料,2025-10-21,临时股东会,股东大会须知; 股东大会议程; 议案一：关于延长公司2024年度向特定对象发行A股股票股东大会决议有效期的议案; 议案二：关于提请股东大会延长授权董事会全权办理公司本次2024年度向特定对象发行A股股票相关事宜有效期的议案,2025年10月21日,8,3993
145994697_2025-10-15_江西铜业股份有限公司2025年第一次临时股东大会、2025年第一次A股类别股东大会、2025年第一次H股类别股东大会会议资料.pdf,江西铜业股份有限公司,江西铜业,未找到,江西铜业股份有限公司2025年第一次临时股东大会会议资料,未找到,临时股东会,会议议程;1.宣布现场会议开始;2.介绍现场会议出列席情况;3.宣读现场会议议程;4.宣读现场会议须知;5.宣读议案;（一）特别决议案;1.审议《关于修订<江西铜业股份有限公司章程>的议案》;2.审议《江西铜业股份有限公司关于取消监事会的议案》;3.审议《关于修订<江西铜业股份有限公司股东会议事规则>的议案》;（二）普通决议案;4.审议《关于修订<江西铜业股份有限公司董事会议事规则>的议案》;5.审议《关于修订<江西铜业股份有限公司独立董事工作制度>的议案》;6.审议《关于修订<江西铜业股份有限公司关联交易管理办法>的议案》;7.审议《关于修订<江西铜业股份有限公司募集资金使用管理办法>的议案》;8.审议《江西铜业股份有限公司关于2025年半年度利润分配方案的议案》;9.审议《江西铜业股份有限公司关于选举刘志宏先生为公司独立非执行董事的议案》;6.股东讨论审议议案;7.通过现场会议计票人和监票人名单;8.现场参会股东进行书面表决投票;9.休会、统计表决结果;10.宣布表决结果及决议草案;11.宣读法律意见书;12.宣布会议结束;会议信息;1.会议召开方式：现场投票和网络投票相结合;2.现场会议召开日期及时间：2025年10月28日14点30分;3.网络投票日期及时间：2025年10月28日，采用上海证券交易所网络投票系统，通过交易系统投票平台的投票时间为股东大会召开当日的交易时间段，即9:15-9:25，9:30-11:30，13:00-15:00；通过互联网投票平台的投票时间为股东大会召开当日的9:15-15:00;4.现场会议召开地点：江西省南昌市高新区昌东大道7666号江铜国际广场公司会议室;5.见证律师：北京德恒律师事务所律师;议案一 关于修订《江西铜业股份有限公司章程》的议案,2025年10月28日,135,96266
145994755_2025-10-15_2025年第一次临时股东会会议资料.pdf,上海至纯洁净系统科技股份有限公司,上海至纯洁净系统科技,未找到,2025年第一次临时股东会会议资料,2025-10-01,临时股东会,会议议程;会议须知;议案一：关于拟发行短期融资券的议案,2025-10-31,6,2462
145994921_2025-10-15_中国银河：2025年第二次临时股东大会会议资料.pdf,中国银河证券股份有限公司,中国银河证券,未找到,2025年第二次临时股东大会会议资料,2025-10-31,临时股东会,1、2025年第二次临时股东大会议程；2、关于提请审议修订《公司章程》的议案；3、关于不再设置公司监事会的议案；4、关于提请审议修订《股东大会议事规则》的议案；5、关于提请审议修订《董事会议事规则》的议案；6、关于提请审议《中国银河证券股份有限公司2025年中期利润分配方案》的议案；7、关于中国银河证券股份有限公司2025年度公司资本性支出预算的议案；8、附件1：《中国银河证券股份有限公司章程》修订对比表；9、附件2：《中国银河证券股份有限公司股东大会议事规则》修订对比表；10、附件3：《中国银河证券股份有限公司董事会议事规则》修订对比表,2025年10月31日,141,122108
145995180_2025-10-15_中金公司2025年第一次临时股东大会会议资料.pdf,中国国际金融股份有限公司,中金公司,未找到,中国国际金融股份有限公司2025年第一次临时股东大会会议资料,2025-10,临时股东会,会议须知;会议议程;议题一：关于不再设立监事会并修订《公司章程》的议案;议题二：关于修订《股东大会议事规则》并更名的议案;议题三：关于修订《董事会议事规则》的议案;议题四：关于选举执行董事并确定其报酬的议案;议题五：关于2025年中期利润分配方案的议案;附件一:《中国国际金融股份有限公司章程》修订对比表,未找到,86,83864
145995805_2025-10-15_中泰证券股份有限公司2025年第二次临时股东会会议材料.pdf,中泰证券股份有限公司,中泰证券,未找到,中泰证券股份有限公司2025年第二次临时股东会会议材料,2025-10,临时股东会,公司2025年第二次临时股东会会议议程;公司2025年第二次临时股东会会议须知;议案1：关于修订《公司章程》及相关附件的议案;议案2：关于修订《公司独立董事工作细则》的议案;议案3：关于修订《公司对外担保管理办法》的议案;议案4：关于修订《公司募集资金管理办法》的议案;议案5：关于续聘容诚会计师事务所（特殊普通合伙）为公司2025年度审计机构的议案;议案6：关于公司控股子公司中泰期货股份有限公司签署日常关联交易框架协议的议案,2025年10月31日,134,108144
145996107_2025-10-15_2025年第三次临时股东大会会议材料.pdf,重庆涪陵电力实业股份有限公司,重庆涪陵电力实业,未找到,重庆涪陵电力实业股份有限公司2025年第三次临时股东大会会议材料,2025-10-23,临时股东会,会议议程;一、审议议案;（一）关于取消监事会及其议事规则的议案;（二）关于修订《公司章程》的议案;（三）关于修订、新增以及废止部分公司治理制度的议案;（四）关于选举第九届董事会非独立董事的议案;1. 选举马文海先生为公司第九届董事会非独立董事;2. 选举蔡彬先生为公司第九届董事会非独立董事;3. 选举王永婷女士为公司第九届董事会非独立董事;4. 选举熊长寿先生为公司第九届董事会非独立董事;5. 选举刘薇女士为公司第九届董事会非独立董事;（五）关于选举第九届董事会独立董事的议案;1.选举刘斌先生为公司第九届董事会独立董事;2.选举曹兴权先生为公司第九届董事会独立董事;3.选举刘伟先生为公司第九届董事会独立董事;（六）关于确定第九届董事会独立董事津贴标准的议案;二、议案表决;三、律师发表现场股东大会见证意见,未找到,11,4393
145996501_2025-10-16_2025年第三次临时股东会会议资料.pdf,北京屹唐半导体科技股份有限公司,屹唐股份,688729,2025年第三次临时股东会会议资料,2025-10,临时股东会,2025年第三次临时股东会会议须知;2025年第三次临时股东会议程;2025年第三次临时股东会议案;议案一：关于变更公司注册资本、公司类型及修订《公司章程》并办理工商变更登记的议案;议案二：关于续聘2025年度审计机构的议案,2025年10月27日,9,4255
145996529_2025-10-16_珀莱雅化妆品股份有限公司2025年第二次临时股东会会议资料.pdf,珀莱雅化妆品股份有限公司,珀莱雅,未找到,珀莱雅化妆品股份有限公司2025年第二次临时股东会会议资料,2025-10,临时股东会,珀莱雅化妆品股份有限公司2025年第二次临时股东会会议须知;珀莱雅化妆品股份有限公司2025年第二次临时股东会议程;珀莱雅2025年第二次临时股东会议案一 关于公司发行H股股票并在香港联合交易所有限公司上市的议案;珀莱雅2025年第二次临时股东会议案二 关于公司发行H股股票并在香港联合交易所有限公司上市方案的议案;珀莱雅2025年第二次临时股东会议案三 关于公司转为境外募集股份有限公司的议案;珀莱雅2025年第二次临时股东会议案四 关于提请股东会授权董事会及/或董事会授权人士全权处理与本次境外公开发行H股并上市有关事项的议案;珀莱雅2025年第二次临时股东会议案五 关于公司发行H股股票募集资金使用计划的议案;珀莱雅2025年第二次临时股东会议案六 关于公司发行H股股票并上市决议有效期的议案;珀莱雅2025年第二次临时股东会议案七 关于公司发行H股股票之前滚存利润分配方案的议案;珀莱雅2025年第二次临时股东会议案八 关于确定公司董事角色的议案;珀莱雅2025年第二次临时股东会议案九 关于投保董事、高级管理人员及招股说明书责任保险的议案;珀莱雅2025年第二次临时股东会议案十 关于修订公司发行H股股票并上市后适用的《公司章程（草案）》及相关议事规则的议案;珀莱雅2025年第二次临时股东会议案十一 关于制定及修订公司发行H股股票并上市后适用的公司内部治理制度的议案;珀莱雅2025年第二次临时股东会议案十二 关于聘请公司发行H股股票并上市的审计机构的议案,2025年10月27日,24,13700
145996530_2025-10-16_2025年第一次临时股东大会会议资料.pdf,宁波天龙电子股份有限公司,宁波天龙电子,未找到,2025年第一次临时股东大会会议资料,2025-10-24,临时股东会,一、2025年第一次临时股东大会会议议程;二、2025年第一次临时股东大会会议须知;三、2025年第一次临时股东大会议案;议案一、关于取消监事会并修订《公司章程》的议案;议案二、关于修订部分公司制度的议案,2025年10月24日,67,52764
145996533_2025-10-16_南京万德斯环保科技股份有限公司2025年第三次临时股东大会会议资料.pdf,南京万德斯环保科技股份有限公司,万德斯,688178,南京万德斯环保科技股份有限公司2025年第三次临时股东大会会议资料,2025-10-28,临时股东会,2025年第三次临时股东大会会议须知;2025年第三次临时股东大会会议议程;2025年第三次临时股东大会会议议案;议案1：关于变更经营范围、取消公司监事会并修订《公司章程》的议案;议案2：关于修订、废止公司部分治理制度的议案,2025年10月28日,10,4822
145996544_2025-10-16_东风电子科技股份有限公司2025年第一次临时股东大会会议资料.pdf,东风电子科技股份有限公司,东风科技,未找到,2025年第一次临时股东大会资料,2025-10,临时股东会,议案一：关于聘请公司2025年度会计师事务所的议案；议案二：关于公司下属公司处置固定资产及应收账款坏账核销的议案；议案三：关于公司2025年向东风汽车财务有限公司追加授信额度的议案；议案四：关于公司与东风汽车财务有限公司续签《金融服务框架协议》暨关联交易的议案；议案五：关于撤销公司监事会的议案；议案六：关于修订《公司章程》及其附件的议案,2025年10月27日14:30,21,12440
145996717_2025-10-16_龙建路桥股份有限公司2025年第二次临时股东大会资料.pdf,龙建路桥股份有限公司,龙建路桥,未找到,2025年第二次临时股东大会资料,2025-10,临时股东会,2025年第二次临时股东大会议程安排;议案1 关于取消监事会并修订《龙建路桥股份有限公司章程》的议案;议案2 关于修订《龙建路桥股份有限公司股东会议事规则》的议案;议案3 关于修订《龙建路桥股份有限公司董事会议事规则》的议案;议案4 关于修订《龙建路桥股份有限公司独立董事工作制度》的议案;议案5.00 关于选举董事的议案;议案5.01 关于增补王艳秋为公司非独立董事的议案,2025.10.27 14:50,113,72089
145996781_2025-10-16_豪森智能2025年第一次临时股东大会会议资料.pdf,大连豪森智能制造股份有限公司,大连豪森智能制造,未找到,2025年第一次临时股东大会会议资料,2025-10-01,临时股东会,大连豪森智能制造股份有限公司2025年第一次临时股东大会会议须知;大连豪森智能制造股份有限公司2025年第一次临时股东大会议程;大连豪森智能制造股份有限公司2025年第一次临时股东大会议案;议案一：关于取消监事会、修订<公司章程>的议案;议案二：关于修订公司部分治理制度的议案;议案三：关于董事会换届选举第三届董事会非独立董事的议案;议案四：关于董事会换届选举第三届董事会独立董事的议案,2025年10月27日,12,5454
145997147_2025-10-16_中国神华2025年第二次临时股东会会议资料.pdf,中国神华能源股份有限公司,中国神华,601088,2025年第二次临时股东会会议资料,2025-09-30,临时股东会,一、会议通知;二、2025年第二次临时股东会议程;三、2025年第二次临时股东会议案;议案一 关于中国神华能源股份有限公司2025年中期利润分配的议案;议案二 关于授予董事会发行股份一般性授权的议案,2025年10月24日,17,7101
145997245_2025-10-16_2025年第二次临时股东大会会议资料.pdf,能科科技股份有限公司,能科科技,未找到,2025年第二次临时股东大会会议资料,2025-10-01,临时股东会,2025年第二次临时股东大会会议须知;2025年第二次临时股东大会会议议程;2025年第二次临时股东大会会议议案;议案一 关于公司符合向特定对象发行A股股票条件的议案;议案二 关于公司2025年度向特定对象发行A股股票方案的议案;议案三 关于公司2025年度向特定对象发行A股股票预案的议案;议案四 关于公司2025年度向特定对象发行A股股票方案论证分析报告的议案;议案五 关于公司2025年度向特定对象发行A股股票募集资金使用可行性分析报告的议案;议案六 关于公司与特定对象签订附条件生效的股份认购协议暨关联交易的议案;议案七 关于公司前次募集资金使用情况报告的议案;议案八 关于公司向特定对象发行股票摊薄即期回报与采取填补措施及相关主体承诺的议案;议案九 关于公司《未来三年（2025年-2027年）股东回报规划》的议案;议案十 关于提请股东大会授权董事会及其授权人士全权办理本次向特定对象发行A股股票相关事宜的议案,2025年10月27日,22,10110
145998099_2025-10-17_新华医疗2025年第一次临时股东大会资料.pdf,山东新华医疗器械股份有限公司,新华医疗,未找到,2025年第一次临时股东大会资料,2025-10-10,临时股东会,2025年第一次临时股东大会会议议程; 关于取消监事会、修订《公司章程》的议案; 关于修订公司部分管理制度的议案; 关于补选公司第十一届董事会独立董事的议案,2025年10月28日,5,2094
145998102_2025-10-17_东浩兰生会展集团股份有限公司2025年第二次临时股东会资料.pdf,东浩兰生会展集团股份有限公司,东浩兰生会展集团,未找到,2025年第二次临时股东会文件,2025-10-27,临时股东会,1、2025年第二次临时股东会议程;2、议案一：关于补选公司第十一届董事会董事的议案,2025年10月27日,5,986
145998181_2025-10-17_腾景科技2025年第一次临时股东大会资料.pdf,腾景科技股份有限公司,腾景科技,688195,2025年第一次临时股东大会会议资料,2025-10-24,临时股东会,股东大会会议须知;股东大会会议议程;议案一：关于《2025年员工持股计划（草案）》及其摘要的议案;议案二：关于《2025年员工持股计划管理办法》的议案;议案三：关于提请股东大会授权董事会办理2025年员工持股计划相关事宜的议案;议案四：关于增加2025年度向金融机构申请授信额度的议案;议案五：关于为控股子公司提供担保的议案;议案六：关于取消监事会、修订《公司章程》暨修订、制定及废止公司部分治理制度的议案;议案七：关于选举第三届董事会非独立董事的议案;议案八：关于选举第三届董事会独立董事的议案,2025年10月24日,25,13290
145998187_2025-10-17_迈得医疗工业设备股份有限公司2025年第一次临时股东大会会议资料.pdf,迈得医疗工业设备股份有限公司,迈得医疗,688310,2025年第一次临时股东大会会议资料,2025-10-30,临时股东会,2025年第一次临时股东大会会议须知;2025年第一次临时股东大会会议议程;2025年第一次临时股东大会会议议案;议案一：关于取消监事会、调整董事会人数、修订《公司章程》并办理工商变更登记的议案;议案二：关于修订及制定公司部分治理制度的议案,2025年10月30日,10,5205
145998227_2025-10-17_嘉华股份2025年第一次临时股东大会会议资料.pdf,山东嘉华生物科技股份有限公司,嘉华股份,未找到,山东嘉华生物科技股份有限公司2025年第一次临时股东大会会议资料,2025-10-29,临时股东会,2025年第一次临时股东大会会议须知;2025年第一次临时股东大会会议议程;2025年第一次临时股东大会会议议案;议案一、关于取消监事会并修订《公司章程》的议案;议案二、关于修订《股东会议事规则》的议案;议案三、关于修订《董事会议事规则》的议案;议案四、关于修订《关联交易管理制度》的议案;议案五、关于修订《重大投资与交易决策制度》的议案;议案六、关于修订《独立董事工作制度》的议案;议案七、关于修订《募集资金管理制度》的议案;议案八、关于修订《防范控股股东、实际控制人及其他关联方占用公司资金管理制度》的议案;议案九、关于制定《董事和高级管理人员薪酬管理制度》的议案;议案十、关于未来三年股东回报规划(2025-2027年)的议案,2025年10月29日,16,5421
145998262_2025-10-17_东风汽车股份有限公司2025年第四次临时股东会资料.pdf,东风汽车股份有限公司,东风汽车,未找到,东风汽车股份有限公司2025年第四次临时股东会资料,2025-10-30,临时股东会,2025年第四次临时股东会会议须知; 会议议程; 议案资料目录; 1、关于调整公司2025年度投资计划的议案; 2、关于取消监事会并修订《公司章程》、《股东会议事规则》及《董事会议事规则》的议案; 3、关于修订《董事会薪酬管理委员会实施细则》的议案,2025年10月30日,31,24591
145998486_2025-10-17_2025年第一次临时股东会会议资料.pdf,神通科技集团股份有限公司,神通科技,未找到,2025年第一次临时股东会会议资料,2025-11,临时股东会,2025年第一次临时股东会会议须知;2025年第一次临时股东会议程;2025年第一次临时股东会议案;议案一 关于公司2025年前三季度利润分配方案的议案;议案二 关于修订<公司章程>及其附件的议案;议案三 关于制定及修订公司相关制度的议案;3.01 修订《独立董事工作制度》;3.02 修订《对外担保管理制度》;3.03 修订《对外投资管理制度》;3.04 修订《防止大股东及关联方占用公司资金管理制度》;3.05 修订《关联交易决策制度》;3.06 修订《累积投票制度》;3.07 修订《募集资金管理制度》;3.08 修订《授权管理制度》,2025年11月3日,13,9954
145998561_2025-10-17_2025年第一次临时股东大会会议资料.pdf,康希诺生物股份公司,康希诺,688185,2025年第一次临时股东大会会议资料,2025-10,临时股东会,2025年第一次临时股东大会会议议程;2025年第一次临时股东大会会议议案;议案一：关于公司《2025年A股限制性股票激励计划（草案）》及其摘要的议案;议案二：关于公司《2025年A股限制性股票激励计划实施考核管理办法》的议案;议案三：关于提请股东大会授权董事会办理2025年A股限制性股票激励计划相关事宜的议案;议案四：关于公司《2025年H股购股权计划》的议案;议案五：关于提请股东大会授权董事会办理2025年H股购股权计划相关事宜的议案;议案六：关于向XUEFENG YU博士授予H股购股权的议案;议案七：关于注销回购A股股份并减少注册资本的议案,2025年10月23日,19,10115
145998588_2025-10-17_北京九州一轨环境科技股份有限公司2025年第四次临时股东大会会议资料.pdf,北京九州一轨环境科技股份有限公司,九州一轨,688485,2025年第四次临时股东大会会议资料,2025-10-29,临时股东会,2025年第四次临时股东大会会议须知;2025年第四次临时股东大会会议议程;2025年第四次临时股东大会会议议案;议案一：关于取消监事会及修订《公司章程》的议案;议案二：关于审议修订、制定及废止公司治理相关制度的议案,2025年10月29日,9,3613
145998602_2025-10-17_石大胜华2025年第五次临时股东大会会议材料.pdf,石大胜华新材料集团股份有限公司,石大胜华新材料集团,未找到,2025年第五次临时股东大会,未找到,临时股东会,一、程序文件；1. 会议议程；2. 会议须知；二、提交股东大会审议的议案；1.关于取消监事会并修订《公司章程》的议案；2.关于修订部分治理制度的议案；3.关于续聘公司2025年度审计机构的议案,2025年10月24日,47,51487
145998634_2025-10-17_悦达投资2025年第一次临时股东大会会议资料.pdf,江苏悦达投资股份有限公司,江苏悦达投资,未找到,2025年第一次临时股东大会议程,未找到,临时股东会,2025年第一次临时股东大会议程;议案一 关于修改公司章程暨取消监事会的议案;议案二 关于修改公司部分治理制度的议案,2025年10月29日,26,25682
